昵称,评论
⚔️,"暗恋时《等你下课》
热恋时《告白气球》
分手时《不爱我就拉倒》
分手后《说好不哭》
周杰伦还是那个最懂青春的人[em]e400867[/em]"
⚔️,"暗恋时《等你下课》
热恋时《告白气球》
分手时《不爱我就拉倒》
分手后《说好不哭》
周杰伦还是那个最懂青春的人[em]e400867[/em]"
听山。,以前一起下课，现在等你下课。
Gnomeshgh,“等你下课”这是我们之间的[em]e401167[/em]语，在我这里是，希望你那也是.
David.,"他写的词，更贴近现实生活中每个人的点点滴滴，从而歌迷听众产生共鸣
吐槽歌词的你真不会欣赏这意境
"
炫plus,我唱告白气球[em]e400197[/em]终于你回了头
小城浅巷忆往昔,"训导处报告！训导处报告！
三年二班，三年二班
海瑟薇！海瑟薇同学！
你老爸周杰伦带了一杯他最喜欢的珍珠奶茶来等你下课！[em]e400826[/em][em]e400850[/em][em]e400850[/em]"
徐徐图之🥳,2016年的歌
林之晨,2016年的歌
酉时日落,要是我考上跟她一样的大学，那我就读大专了[em]e400836[/em]
狐狸先生 ࿐,"高中时总有一个楼梯不是去教室最近的但却是最爱走的；
总有一条路不是去食堂最快的但却是走的最多的；
总有一个教室门口是和自己没关系的但却是爱去偷偷看一眼的；
总有一场篮球比赛是和自己没关系的但却是看的最起劲的。
有那么一节体育课，一个时间段，一个转角，一个楼梯口，课间操一个窗边的某某某。
那段日子叫好好学习。
"
狐狸先生 ࿐,该评论已经被删除
u,语 文 课 代 表
OK.,留名
Чоу,好听
芯,"高考考完想想，暗恋你也有三年了
高一这年，我们同班还是对桌，那个时候可能是我最开心的时候，那时每天可以和你嬉笑打闹，却不知自己已经慢慢喜欢上你了
高二文理分科，你选了文科，而我去了理科，那时的热播的致我们单纯的小美好是你我都喜欢看的，可惜我们注定不能统一文理科，渐渐地，你在文科，我在理科，见面越来越少，可每次见你你都热情的和我打招呼，让我本来不知道该怎么和你相处到每次都期待和你偶遇
眨眼到了高三，高考压在彼此肩上，可我在坚持不下去的时候就会想起你的笑容，然后接着埋头做理综，在高三这年，越发感觉自己越来越喜欢你了，可我不能向你告白，只能把它藏在心里，但是我真的好喜欢你如意，原谅我只敢在这说喜欢你"
凱薩琳princess,"干净的歌词，简单的编曲写的是真的好，被一句“我唱告白气球终于你回了头”感动到不行。
现在很多人听歌都是走马观花，懒到不探寻一首歌背后的作者表达，甚至会觉得没有华丽辞藻的歌词就是没营养、会觉得这样一句词放在后面是凑数…
作者在前面用了几乎整首的“没营养”铺垫着对“她”的复杂情感。谁又肯停下来品味最后这句更“没营养”的“我唱告白气球终于你回了头”其中有多少无奈？
要知道，《告白气球》时，周杰伦已为人父。
爱情…执念…家庭…责任…挚爱…
这是很多男人都必将面对的抉择
遇见与错过，到最后，只能留下一首永远都不可能再实现的《等你下课》
在现实里，等你，下课…不现实。
在时限里，等你，下课…不限时[em]e400832[/em]ཽ"
0717$,要是我考上跟她一样的大学，那我就读大专了[em]e400836[/em]
追,"干净的歌词，简单的编曲写的是真的好，被一句“我唱告白气球终于你回了头”感动到不行。
现在很多人听歌都是走马观花，懒到不探寻一首歌背后的作者表达，甚至会觉得没有华丽辞藻的歌词就是没营养、会觉得这样一句词放在后面是凑数…
作者在前面用了几乎整首的“没营养”铺垫着对“她”的复杂情感。谁又肯停下来品味最后这句更“没营养”的“我唱告白气球终于你回了头”其中有多少无奈？
要知道，《告白气球》时，周杰伦已为人父。
爱情…执念…家庭…责任…挚爱…
这是很多男人都必将面对的抉择
遇见与错过，到最后，只能留下一首永远都不可能再实现的《等你下课》
在现实里，等你，下课…不现实。
在时限里，等你，下课…不限时[em]e400832[/em]ཽ"
江粥,再也回不去纯粹的学生时代了
.,回到2015吧拜托了
十三,想起了三年前中考落榜无缘高中的我，唉
。,我等的她不理我，两个都如此，我不觉得傻，因为我很喜欢她们。不知道以后能否再见，也许此刻她们正和亲爱的厮守，此刻我也和当初的我厮守，她们厮守着幸福，我厮守着快乐，单纯的快乐。。[em]e400832[/em]
~,大半夜听 确实别有一番味道
未  央_,记得上初中时，喜欢一个女孩子。我就喜欢放学的时候在后面跟着她。
可,音好像改变了，我已经300天没听了，好怀念那个她，和她的时候，
羡慕,杰伦还是永远的神
敉勇,那时候，一下课我们就围坐在那里，时光就在那里就是，青春就在那里渐行渐远。现如今的你们都还好吗？在热情奔放的流年里，是否也曾想起过我，想起我们的约定！
默感,"高考考完想想，暗恋你也有三年了
高一这年，我们同班还是对桌，那个时候可能是我最开心的时候，那时每天可以和你嬉笑打闹，却不知自己已经慢慢喜欢上你了
高二文理分科，你选了文科，而我去了理科，那时的热播的致我们单纯的小美好是你我都喜欢看的，可惜我们注定不能统一文理科，渐渐地，你在文科，我在理科，见面越来越少，可每次见你你都热情的和我打招呼，让我本来不知道该怎么和你相处到每次都期待和你偶遇
眨眼到了高三，高考压在彼此肩上，可我在坚持不下去的时候就会想起你的笑容，然后接着埋头做理综，在高三这年，越发感觉自己越来越喜欢你了，可我不能向你告白，只能把它藏在心里，但是我真的好喜欢你如意，原谅我只敢在这说喜欢你"
南栀向暖,想起了三年前中考落榜无缘高中的我，唉
南栀向暖,我好笨啊 没考上山大
金笑雪,好好听哦
王开心🐽,下一场杰伦演唱会，跟我一起的男孩，看完我们回来就结婚吧[em]e401236[/em][em]e401236[/em][em]e401236[/em]
可乐,终于该我问了，2021年了还有人听《等你下课》吗？
一点点丶,专辑，专辑，专辑，
百无一用是深情,你选择单招了，你提前离开学校挂读了，我很难过，但是我不该说出来，你突然闯进我的世界又消失，就这样不顺路了，我就像做了一场梦一样，但是我不能再想了，我要克制自己，我要好好学习。
张塑莱,"马屁我就暂时不拍了
就……
少喝点奶茶吧🥤🥤🥤🥤🥤"
执心,我也想等你下课，还不够格
及,"今天是2021年1月22日，距离高考135天
我不要等你下课，我要一起下课
一定会实现"
离妄,记得出一首《等你下班》哦[em]e400420[/em]
离妄,记得出一首《等你下班》哦
木杉,"整个高中我都没怎么和女生说话，甚至刻意躲避，因为我忘不了她，尽管她已经拒绝了我，我也答应她要好好学习，曾经我好好学习的目标就是和她上一样的大学，最终我的高考成绩出来了，比她高了一些，当我有选择的权利，可以和她上同一所大学的时候，我却退缩了，我想还是算了吧，不打扰她了，当普通朋友也不错，还是要谢谢她，要不是她我高中不会这么努力，也不会考上双一流大学了，谢谢你
可能有些人注定有缘无分吧...
可是现在大学了我还是忘不了她呀啊啊啊啊啊[em]e400867[/em]
你要做一个不动声色的大人了。不准情绪化，不准偷偷想念，不准回头看。去过自己另外的生活，你要听话，不是所有的鱼都会生活在同一片海里。"
棒棒冰,已经过去两个小时，还没下课，为什么是两个小时，等你下课
୧⍤⃝🇨🇳,还是周总的歌听着有味道
今天只吃五顿好啦,身边的你，耳机听的什么，可以告诉我么？
张塑莱,编曲太有感觉了，加油鸭🦆🦆🦆🦆🦆🦆🦆
DL,我终于快要失去你了。
逝者如斯夫，不舍昼夜,都大学了，你还像高中一样喜欢的那样纯粹，你蠢不蠢啊，叶林。
吴宇,高中三年，为什么不好好读书
努力努力再努力C,我炸了防空洞 [em]e400850[/em][em]e400850[/em]
